{
  "$schema": "http://json-schema.org/draft-07/schema#",
  "type": "object",
  "required": ["components", "links"],
  "properties": {
    "components": {
      "type": "array",
      "items": {
        "type": "object",
        "required": ["id", "type"],
        "properties": {
          "id": {
            "type": "string"
          },
          "type": {
            "type": "string"
          },
          "capabilities": {
            "type": "array",
            "items": {
              "type": "string"
            }
          },
          "metadata": {
            "type": "object"
          }
        }
      }
    },
    "links": {
      "type": "array",
      "items": {
        "type": "object",
        "required": ["id", "from", "to"],
        "properties": {
          "id": {
            "type": "string"
          },
          "from": {
            "type": "string"
          },
          "to": {
            "type": "string"
          },
          "data_type": {
            "type": "string"
          },
          "frequency": {
            "type": "string"
          },
          "contract": {
            "type": "object"
          }
        }
      }
    },
    "logic": {
      "type": "object"
    },
    "metadata": {
      "type": "object",
      "properties": {
        "description": {
          "type": "string"
        },
        "created_at": {
          "type": "string"
        },
        "version": {
          "type": "string"
        }
      }
    }
  }
}